{
  "schemaVersion": 1,
  "frozenBeforeAdapterResults": true,
  "sourceCommits": {
    "base": "30791ea331532b5b3f7d627cea37e3736765840c",
    "operator": "eacbcf00dfc2fba941b494e2955e87fffd707382",
    "rimecut": "e021e6083c1e80ad55de744df07e695d60d28bfb"
  },
  "governance": {
    "requiredCheckAdministration": {
      "state": "unverified",
      "effect": "blocked",
      "reason": "GitHub/GitLab 分支保护管理权限尚未验证"
    },
    "runnerAdministration": {
      "state": "unverified",
      "effect": "blocked",
      "reason": "除本机 Linux x86_64 外没有 runner 身份证据"
    },
    "signingAndNotarization": {
      "state": "unverified",
      "effect": "blocked",
      "reason": "Apple/Windows/Android/HarmonyOS 签名与公证权限未验证"
    },
    "supportedRule": "真实目标 runner 上 adapter conformance、smoke、golden、fallback、性能和 package-load 全部通过后才可 supported"
  },
  "platforms": [
    {
      "id": "macos-arm64-coreml",
      "os": "macos",
      "arch": "arm64",
      "minimumOsVersion": "14.0",
      "deviceRunner": "缺失真实 Apple Silicon runner",
      "officialSdkRuntime": "Xcode 16.4 / Core ML (系统框架)",
      "converter": "coremltools 9.0；需要 PyTorch/TensorFlow 源模型，不接受 ONNX 直接转换",
      "artifactFormat": "mlpackage/compiledmodel",
      "adapter": "Core ML adapter（后续任务，当前不存在）",
      "timeoutsMs": {
        "nativeInitialization": 15000,
        "webInitialization": 20000
      },
      "rollbackBaseline": "base 30791ea + operator eacbcf0 + RimeCut e021e60",
      "requiredCiJob": "coreml-macos-arm64-conformance",
      "state": "blocked",
      "evidence": "锁定 coremltools 9.0 可导入，但 ONNX 没有官方直接转换入口，且缺失同源 .pt、Apple 加载 runner 与授权证明",
      "officialVersionEvidence": {
        "checkedOn": "2026-08-10",
        "minimumOs": {
          "value": "14.0",
          "officialSource": "https://apple.github.io/coremltools/docs-guides/source/deployment-compatibility.html",
          "selectionBasis": "最低 OS 是项目验收下限；Core ML artifact 的实际 deployment target 还必须由 Apple runner 产物证明。"
        },
        "sdkRuntime": {
          "value": "Xcode 16.4 / Core ML (系统框架)",
          "officialSource": "https://developer.apple.com/support/xcode/",
          "selectionBasis": "Xcode/系统 Core ML 版本必须由目标 runner 的 xcodebuild 与系统版本采集。"
        },
        "converter": {
          "value": "coremltools 9.0；需要 PyTorch/TensorFlow 源模型，不接受 ONNX 直接转换",
          "officialSource": "https://pypi.org/project/coremltools/9.0/",
          "selectionBasis": "任务 1 Python 工具环境固定 coremltools 9.0；它不提供当前 ONNX 的直接转换链。"
        }
      },
      "operatorConversionEvidence": {
        "path": "evidence/conversions/conversion-spikes.json",
        "blob": "b8ec6d28f6cd834ee7aeea0be1c94c49cf4ada6a",
        "sha256": "55259e0d3fab6e602d7d919fea83b39e0caee864d05b26eb62e68648be03c31b"
      },
      "requiredCiState": "not-established-until-task-3"
    },
    {
      "id": "macos-x86_64-coreml",
      "os": "macos",
      "arch": "x86_64",
      "minimumOsVersion": "14.0",
      "deviceRunner": "缺失 Intel Mac runner",
      "officialSdkRuntime": "Xcode 16.4 / Core ML (系统框架)",
      "converter": "coremltools 9.0；需要 PyTorch/TensorFlow 源模型，不接受 ONNX 直接转换",
      "artifactFormat": "mlpackage/compiledmodel",
      "adapter": "Core ML adapter（后续任务，当前不存在）",
      "timeoutsMs": {
        "nativeInitialization": 15000,
        "webInitialization": 20000
      },
      "rollbackBaseline": "base 30791ea + operator eacbcf0 + RimeCut e021e60",
      "requiredCiJob": "coreml-macos-x64-conformance",
      "state": "blocked",
      "evidence": "没有同源 .pt、macOS x86_64 runner 或转换/加载报告",
      "officialVersionEvidence": {
        "checkedOn": "2026-08-10",
        "minimumOs": {
          "value": "14.0",
          "officialSource": "https://apple.github.io/coremltools/docs-guides/source/deployment-compatibility.html",
          "selectionBasis": "最低 OS 是项目验收下限；Core ML artifact 的实际 deployment target 还必须由 Apple runner 产物证明。"
        },
        "sdkRuntime": {
          "value": "Xcode 16.4 / Core ML (系统框架)",
          "officialSource": "https://developer.apple.com/support/xcode/",
          "selectionBasis": "Xcode/系统 Core ML 版本必须由目标 runner 的 xcodebuild 与系统版本采集。"
        },
        "converter": {
          "value": "coremltools 9.0；需要 PyTorch/TensorFlow 源模型，不接受 ONNX 直接转换",
          "officialSource": "https://pypi.org/project/coremltools/9.0/",
          "selectionBasis": "任务 1 Python 工具环境固定 coremltools 9.0；它不提供当前 ONNX 的直接转换链。"
        }
      },
      "operatorConversionEvidence": {
        "path": "evidence/conversions/conversion-spikes.json",
        "blob": "b8ec6d28f6cd834ee7aeea0be1c94c49cf4ada6a",
        "sha256": "55259e0d3fab6e602d7d919fea83b39e0caee864d05b26eb62e68648be03c31b"
      },
      "requiredCiState": "not-established-until-task-3"
    },
    {
      "id": "ios-arm64-coreml",
      "os": "ios",
      "arch": "arm64",
      "minimumOsVersion": "17.0",
      "deviceRunner": "缺失真实 iPhone/iPad runner；模拟器不可替代",
      "officialSdkRuntime": "Xcode 16.4 / Core ML (系统框架)",
      "converter": "coremltools 9.0；需要 PyTorch/TensorFlow 源模型，不接受 ONNX 直接转换",
      "artifactFormat": "compiledmodel",
      "adapter": "Core ML adapter（后续任务，当前不存在）",
      "timeoutsMs": {
        "nativeInitialization": 30000,
        "webInitialization": 30000
      },
      "rollbackBaseline": "base 30791ea + operator eacbcf0 + RimeCut e021e60",
      "requiredCiJob": "coreml-ios-device-conformance",
      "state": "blocked",
      "evidence": "缺少同源 .pt、Apple 工具链、签名和真实设备",
      "officialVersionEvidence": {
        "checkedOn": "2026-08-10",
        "minimumOs": {
          "value": "17.0",
          "officialSource": "https://apple.github.io/coremltools/docs-guides/source/deployment-compatibility.html",
          "selectionBasis": "最低 OS 是项目验收下限；Core ML artifact 的实际 deployment target 还必须由 Apple runner 产物证明。"
        },
        "sdkRuntime": {
          "value": "Xcode 16.4 / Core ML (系统框架)",
          "officialSource": "https://developer.apple.com/support/xcode/",
          "selectionBasis": "Xcode/系统 Core ML 版本必须由目标 runner 的 xcodebuild 与系统版本采集。"
        },
        "converter": {
          "value": "coremltools 9.0；需要 PyTorch/TensorFlow 源模型，不接受 ONNX 直接转换",
          "officialSource": "https://pypi.org/project/coremltools/9.0/",
          "selectionBasis": "任务 1 Python 工具环境固定 coremltools 9.0；它不提供当前 ONNX 的直接转换链。"
        }
      },
      "operatorConversionEvidence": {
        "path": "evidence/conversions/conversion-spikes.json",
        "blob": "b8ec6d28f6cd834ee7aeea0be1c94c49cf4ada6a",
        "sha256": "55259e0d3fab6e602d7d919fea83b39e0caee864d05b26eb62e68648be03c31b"
      },
      "requiredCiState": "not-established-until-task-3"
    },
    {
      "id": "android-arm64-litert-v2",
      "os": "android",
      "arch": "arm64-v8a",
      "minimumOsVersion": "API 26",
      "deviceRunner": "已观测真实目标 runner：Samsung SM-S9210 / RFCX90C568W / Android 16 API 36 / arm64-v8a",
      "officialSdkRuntime": "LiteRT v2 2.1.6 / Android NDK r27c",
      "converter": "Validation 已接受外部 TFLite candidate；conversion manifest SHA-256 f1f95bac2006cd02e364123ab9e7556cc331e6d20f49006c50fcebd15d0c4881，LiteRT runtime 不承担 ONNX 转换",
      "artifactFormat": "tflite/CompiledModel",
      "adapter": "LiteRT v2 CompiledModel adapter（AndroidLiteRtV2Factory -> CompiledModel -> RuntimeBackend::infer）",
      "timeoutsMs": {
        "nativeInitialization": 30000,
        "webInitialization": 30000
      },
      "rollbackBaseline": "base 30791ea + operator eacbcf0 + RimeCut e021e60",
      "requiredCiJob": "litert-android-arm64-device-conformance",
      "state": "blocked",
      "evidence": "真实 runner/conformance 已观察；Base closure reports/rfb-android-base-closure-01.json 绑定 device manifest bc7ab86c8afc89b019ed3831fdad0a23ec9b2d15d8ec2c9adba6d765a5b322ff、Validation report b9aa52ce8e046f67cca266b0ad90763f83cec3a692b81d0318ca0a94b460098c 与 bundle sha256-0c309e3f63aa69920a1ac55a42b0a5211771671bf7df0fa180205550ce535866；性能比较例外使 recommendation/support 仍 blocked",
      "officialVersionEvidence": {
        "checkedOn": "2026-08-10",
        "minimumOs": {
          "value": "API 26",
          "officialSource": "https://developer.android.com/tools/releases/platforms",
          "selectionBasis": "API 26 是项目接受下限；真实 CompiledModel accelerator 能力仍按设备探测。"
        },
        "sdkRuntime": {
          "value": "LiteRT v2 2.1.6 / Android NDK r27c",
          "officialSource": "https://ai.google.dev/edge/litert/next/get_started",
          "selectionBasis": "LiteRT v2 runtime 固定为 PyPI/Android artifact 的 2.1.6 线，设备侧版本必须同报告。"
        },
        "converter": {
          "value": "ai-edge-litert 2.1.6 仅提供 TFLite runtime；ONNX 到 TFLite 导出链尚未获准且缺少同源源模型",
          "officialSource": "https://ai.google.dev/edge/litert/models/convert",
          "selectionBasis": "LiteRT 接受 TFLite；ONNX 不是 ai-edge-litert runtime 包提供的转换入口。"
        }
      },
      "operatorConversionEvidence": {
        "path": "evidence/conversions/conversion-spikes.json",
        "blob": "b8ec6d28f6cd834ee7aeea0be1c94c49cf4ada6a",
        "sha256": "55259e0d3fab6e602d7d919fea83b39e0caee864d05b26eb62e68648be03c31b"
      },
      "requiredCiState": "not-established-until-task-3"
    },
    {
      "id": "windows-x86_64-windowsml",
      "os": "windows",
      "arch": "x86_64",
      "minimumOsVersion": "Windows 11 23H2",
      "deviceRunner": "缺失 Windows x64 runner",
      "officialSdkRuntime": "Windows App SDK 1.8 / Windows ML",
      "converter": "无格式转换：直接加载 ONNX",
      "artifactFormat": "onnx",
      "adapter": "Windows ML adapter（后续任务，当前不存在）",
      "timeoutsMs": {
        "nativeInitialization": 20000,
        "webInitialization": 25000
      },
      "rollbackBaseline": "base 30791ea + operator eacbcf0 + RimeCut e021e60",
      "requiredCiJob": "windowsml-x64-conformance",
      "state": "blocked",
      "evidence": "Linux 上 pwsh/Windows ML 不可用，实际 LoadFromFilePath 未执行成功",
      "officialVersionEvidence": {
        "checkedOn": "2026-08-10",
        "minimumOs": {
          "value": "Windows 11 23H2",